attrs : 
{
    bcdUSB = 0x200;
    bDeviceClass = 0x0;
    bDeviceSubClass = 0x0;
    bDeviceProtocol = 0x0;
    bMaxPacketSize0 = 0x40;
    idVendor = 0x1D6B;
    idProduct = 0x104;
    bcdDevice = 0x1;
};
os_descs : 
{
    use = 0;
    qw_sign = "";
    b_vendor_code = 0x0;
};
strings = ( 
    {
        lang = 0x409;
        manufacturer = "Foo Inc.";
        product = "Bar Gadget";
        serialnumber = "0123456789";
    } );
functions : 
{
    acm_usb0 : 
    {
        instance = "usb0";
        type = "acm";
        attrs : 
        {
        };
        os_descs = ( );
    };
    ncm_usb0 : 
    {
        instance = "usb0";
        type = "ncm";
        attrs : 
        {
            dev_addr = "96:db:2c:02:3e:a3";
            host_addr = "ea:d5:72:e2:48:89";
            qmult = 5;
        };
        os_descs = ( );
    };
    ffs_mtp :
    {
        instance = "mtp";
        type = "ffs";
        attrs :
        {
        };
        os_descs = ( );
    };
};
configs = ( 
    {
        id = 1;
        name = "The only one";
        attrs : 
        {
            bmAttributes = 0x80;
            bMaxPower = 0x2;
        };
        strings = ( 
            {
                lang = 0x409;
                configuration = "CDC ACM+NCM+MTP";
            } );
        functions = ( 
            {
                name = "acm.GS0";
                function = "acm_usb0";
            }, 
            {
                name = "ncm.usb0";
                function = "ncm_usb0";
            },
            {
                name = "mtp";
                function = "ffs_mtp";
            } );
    } );
